{
	"animation_clips": {
		"basic_punch": {
			"clip_id": "basic_punch",
			"frame_sequence_ref": "basic_punch",
			"loop": false
		},
		"hurt": {
			"clip_id": "hurt",
			"frame_sequence_ref": "hurt",
			"loop": false
		},
		"idle": {
			"clip_id": "idle",
			"frame_sequence_ref": "idle",
			"loop": true
		},
		"run": {
			"clip_id": "run",
			"frame_sequence_ref": "run",
			"loop": true
		},
		"walk": {
			"clip_id": "walk",
			"frame_sequence_ref": "walk",
			"loop": true
		}
	},
	"frame_sequences": {
		"basic_punch": [
			"res://godot/assets/frames/skeleton_default_unarmed_s64/basic_punch/frame_000.png",
			"res://godot/assets/frames/skeleton_default_unarmed_s64/basic_punch/frame_001.png",
			"res://godot/assets/frames/skeleton_default_unarmed_s64/basic_punch/frame_002.png",
			"res://godot/assets/frames/skeleton_default_unarmed_s64/basic_punch/frame_003.png",
			"res://godot/assets/frames/skeleton_default_unarmed_s64/basic_punch/frame_004.png",
			"res://godot/assets/frames/skeleton_default_unarmed_s64/basic_punch/frame_005.png",
			"empty://skeleton_default_unarmed_s64/basic_punch/frame_006.png",
			"empty://skeleton_default_unarmed_s64/basic_punch/frame_007.png"
		],
		"hurt": [
			"res://godot/assets/frames/skeleton_default_unarmed_s64/hurt/frame_000.png",
			"res://godot/assets/frames/skeleton_default_unarmed_s64/hurt/frame_001.png"
		],
		"idle": [
			"res://godot/assets/frames/skeleton_default_unarmed_s64/idle/frame_000.png",
			"res://godot/assets/frames/skeleton_default_unarmed_s64/idle/frame_001.png",
			"res://godot/assets/frames/skeleton_default_unarmed_s64/idle/frame_002.png",
			"res://godot/assets/frames/skeleton_default_unarmed_s64/idle/frame_003.png",
			"res://godot/assets/frames/skeleton_default_unarmed_s64/idle/frame_004.png",
			"res://godot/assets/frames/skeleton_default_unarmed_s64/idle/frame_005.png"
		],
		"run": [
			"res://godot/assets/frames/skeleton_default_unarmed_s64/run/frame_000.png",
			"res://godot/assets/frames/skeleton_default_unarmed_s64/run/frame_001.png",
			"res://godot/assets/frames/skeleton_default_unarmed_s64/run/frame_002.png",
			"res://godot/assets/frames/skeleton_default_unarmed_s64/run/frame_003.png",
			"res://godot/assets/frames/skeleton_default_unarmed_s64/run/frame_004.png",
			"res://godot/assets/frames/skeleton_default_unarmed_s64/run/frame_005.png"
		],
		"walk": [
			"res://godot/assets/frames/skeleton_default_unarmed_s64/walk/frame_000.png",
			"res://godot/assets/frames/skeleton_default_unarmed_s64/walk/frame_001.png",
			"res://godot/assets/frames/skeleton_default_unarmed_s64/walk/frame_002.png",
			"res://godot/assets/frames/skeleton_default_unarmed_s64/walk/frame_003.png",
			"res://godot/assets/frames/skeleton_default_unarmed_s64/walk/frame_004.png",
			"res://godot/assets/frames/skeleton_default_unarmed_s64/walk/frame_005.png"
		]
	},
	"required_moves_mapping": {
		"basic_punch": "basic_punch",
		"hurt": "hurt",
		"idle": "idle",
		"run": "run",
		"walk": "walk"
	},
	"schema_version": "0.3",
	"sprite_set_id": "skeleton_default_unarmed_s64"
}
